{
    "type": "FeatureCollection",
    "features": [
        {
            "type": "Feature",
            "properties": {
                "name": "03/01/15",
                "time": "2015-01-03T11:02:19.000-05:00",
                "coordTimes": [
                    [
                        "2015-01-03T11:02:19.000-05:00",
                        "2015-01-03T18:01:13.000-05:00"
                    ],
                    [
                        "2015-01-03T18:07:48.000-05:00",
                        "2015-01-03T18:28:12.000-05:00"
                    ],
                    [
                        "2015-01-03T18:35:23.000-05:00",
                        "2015-01-04T00:00:00.000-05:00"
                    ]
                ]
            },
            "geometry": {
                "type": "MultiLineString",
                "coordinates": [
                    [
                        [
                            -77.016245267,
                            38.9087781337
                        ],
                        [
                            -77.016245267,
                            38.9087781337
                        ]
                    ],
                    [
                        [
                            -77.02268076867074,
                            38.90897736048679
                        ],
                        [
                            -77.02268076867074,
                            38.90897736048679
                        ]
                    ],
                    [
                        [
                            -77.016245267,
                            38.9087781337
                        ],
                        [
                            -77.016245267,
                            38.9087781337
                        ]
                    ]
                ]
            }
        },
        {
            "type": "Feature",
            "properties": {
                "name": "04/01/15",
                "time": "2015-01-04T00:00:00.000-05:00",
                "coordTimes": [
                    [
                        "2015-01-04T00:00:00.000-05:00",
                        "2015-01-04T11:16:31.000-05:00"
                    ],
                    [
                        "2015-01-04T11:36:11.000-05:00",
                        "2015-01-04T13:20:55.000-05:00"
                    ],
                    [
                        "2015-01-04T13:31:43.000-05:00",
                        "2015-01-04T14:22:08.000-05:00"
                    ],
                    [
                        "2015-01-04T14:26:05.000-05:00",
                        "2015-01-04T14:38:29.000-05:00"
                    ],
                    [
                        "2015-01-04T14:44:48.000-05:00",
                        "2015-01-04T15:45:02.000-05:00"
                    ],
                    [
                        "2015-01-04T16:13:37.000-05:00",
                        "2015-01-05T00:00:00.000-05:00"
                    ]
                ]
            },
            "geometry": {
                "type": "MultiLineString",
                "coordinates": [
                    [
                        [
                            -77.016245267,
                            38.9087781337
                        ],
                        [
                            -77.016245267,
                            38.9087781337
                        ]
                    ],
                    [
                        [
                            -77.0209825411668,
                            38.898754083782165
                        ],
                        [
                            -77.0209825411668,
                            38.898754083782165
                        ]
                    ],
                    [
                        [
                            -77.02343427920846,
                            38.89984296582372
                        ],
                        [
                            -77.02343427920846,
                            38.89984296582372
                        ]
                    ],
                    [
                        [
                            -77.0218632946,
                            38.8998058089
                        ],
                        [
                            -77.0218632946,
                            38.8998058089
                        ]
                    ],
                    [
                        [
                            -77.03312873840332,
                            38.92935218511513
                        ],
                        [
                            -77.03312873840332,
                            38.92935218511513
                        ]
                    ],
                    [
                        [
                            -77.016245267,
                            38.9087781337
                        ],
                        [
                            -77.016245267,
                            38.9087781337
                        ]
                    ]
                ]
            }
        },
        {
            "type": "Feature",
            "properties": {
                "name": "05/01/15",
                "time": "2015-01-05T00:00:00.000-05:00",
                "coordTimes": [
                    [
                        "2015-01-05T00:00:00.000-05:00",
                        "2015-01-05T07:43:27.000-05:00"
                    ],
                    [
                        "2015-01-05T08:25:35.000-05:00",
                        "2015-01-05T18:26:33.000-05:00"
                    ],
                    [
                        "2015-01-05T18:39:45.000-05:00",
                        "2015-01-05T18:50:42.000-05:00"
                    ],
                    [
                        "2015-01-05T18:55:31.000-05:00",
                        "2015-01-05T20:46:18.000-05:00"
                    ],
                    [
                        "2015-01-05T20:51:53.000-05:00",
                        "2015-01-05T20:57:51.000-05:00"
                    ],
                    [
                        "2015-01-05T21:23:01.000-05:00",
                        "2015-01-06T00:00:00.000-05:00"
                    ]
                ]
            },
            "geometry": {
                "type": "MultiLineString",
                "coordinates": [
                    [
                        [
                            -77.016245267,
                            38.9087781337
                        ],
                        [
                            -77.016245267,
                            38.9087781337
                        ]
                    ],
                    [
                        [
                            -77.06889867782593,
                            38.896978274248625
                        ],
                        [
                            -77.06889867782593,
                            38.896978274248625
                        ]
                    ],
                    [
                        [
                            -77.04892158508301,
                            38.90078577147122
                        ],
                        [
                            -77.04892158508301,
                            38.90078577147122
                        ]
                    ],
                    [
                        [
                            -77.0534003788,
                            38.9012145043
                        ],
                        [
                            -77.0534003788,
                            38.9012145043
                        ]
                    ],
                    [
                        [
                            -77.0511337981,
                            38.9008143961
                        ],
                        [
                            -77.0511337981,
                            38.9008143961
                        ]
                    ],
                    [
                        [
                            -77.016245267,
                            38.9087781337
                        ],
                        [
                            -77.016245267,
                            38.9087781337
                        ]
                    ]
                ]
            }
        },
        {
            "type": "Feature",
            "properties": {
                "name": "06/01/15",
                "time": "2015-01-06T00:00:00.000-05:00",
                "coordTimes": [
                    [
                        "2015-01-06T00:00:00.000-05:00",
                        "2015-01-06T07:49:58.000-05:00"
                    ],
                    [
                        "2015-01-06T08:42:47.000-05:00",
                        "2015-01-06T17:50:32.000-05:00"
                    ],
                    [
                        "2015-01-06T18:31:05.000-05:00",
                        "2015-01-06T19:25:03.000-05:00"
                    ],
                    [
                        "2015-01-06T19:43:24.000-05:00",
                        "2015-01-06T22:58:01.000-05:00"
                    ],
                    [
                        "2015-01-06T23:03:08.000-05:00",
                        "2015-01-06T23:08:21.000-05:00"
                    ],
                    [
                        "2015-01-06T23:24:15.000-05:00",
                        "2015-01-07T00:00:00.000-05:00"
                    ]
                ]
            },
            "geometry": {
                "type": "MultiLineString",
                "coordinates": [
                    [
                        [
                            -77.016245267,
                            38.9087781337
                        ],
                        [
                            -77.016245267,
                            38.9087781337
                        ]
                    ],
                    [
                        [
                            -77.06889867782593,
                            38.896978274248625
                        ],
                        [
                            -77.06889867782593,
                            38.896978274248625
                        ]
                    ],
                    [
                        [
                            -77.02795524396792,
                            38.916893595943236
                        ],
                        [
                            -77.02795524396792,
                            38.916893595943236
                        ]
                    ],
                    [
                        [
                            -77.02415966925224,
                            38.916707159161525
                        ],
                        [
                            -77.02415966925224,
                            38.916707159161525
                        ]
                    ],
                    [
                        [
                            -77.02170232261857,
                            38.915529044065465
                        ],
                        [
                            -77.02170232261857,
                            38.915529044065465
                        ]
                    ],
                    [
                        [
                            -77.016245267,
                            38.9087781337
                        ],
                        [
                            -77.016245267,
                            38.9087781337
                        ]
                    ]
                ]
            }
        },
        {
            "type": "Feature",
            "properties": {
                "name": "07/01/15",
                "time": "2015-01-07T00:00:00.000-05:00",
                "coordTimes": [
                    [
                        "2015-01-07T00:00:00.000-05:00",
                        "2015-01-07T07:55:19.000-05:00"
                    ],
                    [
                        "2015-01-07T08:42:20.000-05:00",
                        "2015-01-07T12:26:38.000-05:00"
                    ],
                    [
                        "2015-01-07T12:31:58.000-05:00",
                        "2015-01-07T12:40:39.000-05:00"
                    ],
                    [
                        "2015-01-07T12:45:55.000-05:00",
                        "2015-01-07T18:46:08.000-05:00"
                    ],
                    [
                        "2015-01-07T18:53:54.000-05:00",
                        "2015-01-07T19:00:30.000-05:00"
                    ],
                    [
                        "2015-01-07T19:20:01.000-05:00",
                        "2015-01-07T20:48:58.000-05:00"
                    ],
                    [
                        "2015-01-07T21:06:58.000-05:00",
                        "2015-01-07T21:11:09.000-05:00"
                    ],
                    [
                        "2015-01-07T21:21:24.000-05:00",
                        "2015-01-08T00:00:00.000-05:00"
                    ]
                ]
            },
            "geometry": {
                "type": "MultiLineString",
                "coordinates": [
                    [
                        [
                            -77.016245267,
                            38.9087781337
                        ],
                        [
                            -77.016245267,
                            38.9087781337
                        ]
                    ],
                    [
                        [
                            -77.06889867782593,
                            38.896978274248625
                        ],
                        [
                            -77.06889867782593,
                            38.896978274248625
                        ]
                    ],
                    [
                        [
                            -77.07069039344788,
                            38.89536670625987
                        ],
                        [
                            -77.07069039344788,
                            38.89536670625987
                        ]
                    ],
                    [
                        [
                            -77.06889867782593,
                            38.896978274248625
                        ],
                        [
                            -77.06889867782593,
                            38.896978274248625
                        ]
                    ],
                    [
                        [
                            -77.0709748424,
                            38.8959804593
                        ],
                        [
                            -77.0709748424,
                            38.8959804593
                        ]
                    ],
                    [
                        [
                            -77.03717658877457,
                            38.91693924667396
                        ],
                        [
                            -77.03717658877457,
                            38.91693924667396
                        ]
                    ],
                    [
                        [
                            -77.02191038364764,
                            38.91582809562651
                        ],
                        [
                            -77.02191038364764,
                            38.91582809562651
                        ]
                    ],
                    [
                        [
                            -77.016245267,
                            38.9087781337
                        ],
                        [
                            -77.016245267,
                            38.9087781337
                        ]
                    ]
                ]
            }
        },
        {
            "type": "Feature",
            "properties": {
                "name": "08/01/15",
                "time": "2015-01-08T00:00:00.000-05:00",
                "coordTimes": [
                    [
                        "2015-01-08T00:00:00.000-05:00",
                        "2015-01-08T08:11:56.000-05:00"
                    ],
                    [
                        "2015-01-08T08:59:45.000-05:00",
                        "2015-01-08T14:50:59.000-05:00"
                    ],
                    [
                        "2015-01-08T14:56:03.000-05:00",
                        "2015-01-08T16:30:01.000-05:00"
                    ],
                    [
                        "2015-01-08T16:33:42.000-05:00",
                        "2015-01-08T17:53:33.000-05:00"
                    ],
                    [
                        "2015-01-08T18:02:52.000-05:00",
                        "2015-01-08T21:18:10.000-05:00"
                    ],
                    [
                        "2015-01-08T21:38:56.000-05:00",
                        "2015-01-09T00:00:00.000-05:00"
                    ]
                ]
            },
            "geometry": {
                "type": "MultiLineString",
                "coordinates": [
                    [
                        [
                            -77.016245267,
                            38.9087781337
                        ],
                        [
                            -77.016245267,
                            38.9087781337
                        ]
                    ],
                    [
                        [
                            -77.06889867782593,
                            38.896978274248625
                        ],
                        [
                            -77.06889867782593,
                            38.896978274248625
                        ]
                    ],
                    [
                        [
                            -77.086248,
                            38.890392
                        ],
                        [
                            -77.086248,
                            38.890392
                        ]
                    ],
                    [
                        [
                            -77.06889867782593,
                            38.896978274248625
                        ],
                        [
                            -77.06889867782593,
                            38.896978274248625
                        ]
                    ],
                    [
                        [
                            -77.06998537232505,
                            38.89491400797571
                        ],
                        [
                            -77.06998537232505,
                            38.89491400797571
                        ]
                    ],
                    [
                        [
                            -77.016245267,
                            38.9087781337
                        ],
                        [
                            -77.016245267,
                            38.9087781337
                        ]
                    ]
                ]
            }
        },
        {
            "type": "Feature",
            "properties": {
                "name": "09/01/15",
                "time": "2015-01-09T00:00:00.000-05:00",
                "coordTimes": [
                    [
                        "2015-01-09T00:00:00.000-05:00",
                        "2015-01-09T09:16:05.000-05:00"
                    ],
                    [
                        "2015-01-09T09:28:19.000-05:00",
                        "2015-01-09T12:10:32.000-05:00"
                    ],
                    [
                        "2015-01-09T12:13:38.000-05:00",
                        "2015-01-09T12:17:02.000-05:00"
                    ],
                    [
                        "2015-01-09T12:19:35.000-05:00",
                        "2015-01-09T17:18:46.000-05:00"
                    ],
                    [
                        "2015-01-09T17:27:29.000-05:00",
                        "2015-01-10T00:00:00.000-05:00"
                    ]
                ]
            },
            "geometry": {
                "type": "MultiLineString",
                "coordinates": [
                    [
                        [
                            -77.016245267,
                            38.9087781337
                        ],
                        [
                            -77.016245267,
                            38.9087781337
                        ]
                    ],
                    [
                        [
                            -77.0341572380347,
                            38.904864216921446
                        ],
                        [
                            -77.0341572380347,
                            38.904864216921446
                        ]
                    ],
                    [
                        [
                            -77.03473075179647,
                            38.90331048014187
                        ],
                        [
                            -77.03473075179647,
                            38.90331048014187
                        ]
                    ],
                    [
                        [
                            -77.0341572380347,
                            38.904864216921446
                        ],
                        [
                            -77.0341572380347,
                            38.904864216921446
                        ]
                    ],
                    [
                        [
                            -77.016245267,
                            38.9087781337
                        ],
                        [
                            -77.016245267,
                            38.9087781337
                        ]
                    ]
                ]
            }
        },
        {
            "type": "Feature",
            "properties": {
                "name": "10/01/15",
                "time": "2015-01-10T00:00:00.000-05:00",
                "coordTimes": [
                    [
                        "2015-01-10T00:00:00.000-05:00",
                        "2015-01-10T13:30:56.000-05:00"
                    ],
                    [
                        "2015-01-10T13:38:14.000-05:00",
                        "2015-01-10T15:34:39.000-05:00"
                    ],
                    [
                        "2015-01-10T16:01:35.000-05:00",
                        "2015-01-10T19:03:44.000-05:00"
                    ],
                    [
                        "2015-01-10T19:17:11.000-05:00",
                        "2015-01-10T19:49:27.000-05:00"
                    ],
                    [
                        "2015-01-10T20:27:25.000-05:00",
                        "2015-01-11T00:00:00.000-05:00"
                    ]
                ]
            },
            "geometry": {
                "type": "MultiLineString",
                "coordinates": [
                    [
                        [
                            -77.016245267,
                            38.9087781337
                        ],
                        [
                            -77.016245267,
                            38.9087781337
                        ]
                    ],
                    [
                        [
                            -77.02178835868835,
                            38.910295272896086
                        ],
                        [
                            -77.02178835868835,
                            38.910295272896086
                        ]
                    ],
                    [
                        [
                            -77.02686309814453,
                            38.89612656929811
                        ],
                        [
                            -77.02686309814453,
                            38.89612656929811
                        ]
                    ],
                    [
                        [
                            -77.0219578017,
                            38.8989648658
                        ],
                        [
                            -77.0219578017,
                            38.8989648658
                        ]
                    ],
                    [
                        [
                            -77.0021317164,
                            38.9194274207
                        ],
                        [
                            -77.0021317164,
                            38.9194274207
                        ]
                    ]
                ]
            }
        },
        {
            "type": "Feature",
            "properties": {
                "name": "11/01/15",
                "time": "2015-01-11T00:00:00.000-05:00",
                "coordTimes": [
                    [
                        "2015-01-11T00:00:00.000-05:00",
                        "2015-01-11T05:22:46.000-05:00"
                    ],
                    [
                        "2015-01-11T09:57:37.000-05:00",
                        "2015-01-11T10:40:59.000-05:00"
                    ],
                    [
                        "2015-01-11T10:55:32.000-05:00",
                        "2015-01-11T11:43:17.000-05:00"
                    ],
                    [
                        "2015-01-11T11:54:14.000-05:00",
                        "2015-01-11T13:48:37.000-05:00"
                    ],
                    [
                        "2015-01-11T13:48:38.000-05:00",
                        "2015-01-11T14:49:00.000-05:00"
                    ],
                    [
                        "2015-01-11T15:08:41.000-05:00",
                        "2015-01-12T00:00:00.000-05:00"
                    ]
                ]
            },
            "geometry": {
                "type": "MultiLineString",
                "coordinates": [
                    [
                        [
                            -77.0021317164,
                            38.9194274207
                        ],
                        [
                            -77.0021317164,
                            38.9194274207
                        ]
                    ],
                    [
                        [
                            -77.0021317164,
                            38.9194274207
                        ],
                        [
                            -77.0021317164,
                            38.9194274207
                        ]
                    ],
                    [
                        [
                            -77.016245267,
                            38.9087781337
                        ],
                        [
                            -77.016245267,
                            38.9087781337
                        ]
                    ],
                    [
                        [
                            -77.0209825411668,
                            38.898754083782165
                        ],
                        [
                            -77.0209825411668,
                            38.898754083782165
                        ]
                    ],
                    [
                        [
                            -77.02391787305378,
                            38.89780738495169
                        ],
                        [
                            -77.02391787305378,
                            38.89780738495169
                        ]
                    ],
                    [
                        [
                            -77.016245267,
                            38.9087781337
                        ],
                        [
                            -77.016245267,
                            38.9087781337
                        ]
                    ]
                ]
            }
        },
        {
            "type": "Feature",
            "properties": {
                "name": "12/01/15",
                "time": "2015-01-12T00:00:00.000-05:00",
                "coordTimes": [
                    [
                        "2015-01-12T00:00:00.000-05:00",
                        "2015-01-12T08:03:49.000-05:00"
                    ],
                    [
                        "2015-01-12T08:43:54.000-05:00",
                        "2015-01-12T12:12:34.000-05:00"
                    ],
                    [
                        "2015-01-12T12:20:43.000-05:00",
                        "2015-01-12T12:30:02.000-05:00"
                    ],
                    [
                        "2015-01-12T12:36:19.000-05:00",
                        "2015-01-12T16:33:35.000-05:00"
                    ],
                    [
                        "2015-01-12T16:55:15.000-05:00",
                        "2015-01-12T17:20:21.000-05:00"
                    ],
                    [
                        "2015-01-12T17:28:05.000-05:00",
                        "2015-01-13T00:00:00.000-05:00"
                    ]
                ]
            },
            "geometry": {
                "type": "MultiLineString",
                "coordinates": [
                    [
                        [
                            -77.016245267,
                            38.9087781337
                        ],
                        [
                            -77.016245267,
                            38.9087781337
                        ]
                    ],
                    [
                        [
                            -77.06889867782593,
                            38.896978274248625
                        ],
                        [
                            -77.06889867782593,
                            38.896978274248625
                        ]
                    ],
                    [
                        [
                            -77.07078355566608,
                            38.895051124541055
                        ],
                        [
                            -77.07078355566608,
                            38.895051124541055
                        ]
                    ],
                    [
                        [
                            -77.06889867782593,
                            38.896978274248625
                        ],
                        [
                            -77.06889867782593,
                            38.896978274248625
                        ]
                    ],
                    [
                        [
                            -77.02268076867074,
                            38.90897736048679
                        ],
                        [
                            -77.02268076867074,
                            38.90897736048679
                        ]
                    ],
                    [
                        [
                            -77.016245267,
                            38.9087781337
                        ],
                        [
                            -77.016245267,
                            38.9087781337
                        ]
                    ]
                ]
            }
        },
        {
            "type": "Feature",
            "properties": {
                "name": "13/01/15",
                "time": "2015-01-13T00:00:00.000-05:00",
                "coordTimes": [
                    [
                        "2015-01-13T00:00:00.000-05:00",
                        "2015-01-13T08:12:04.000-05:00"
                    ],
                    [
                        "2015-01-13T08:58:48.000-05:00",
                        "2015-01-13T18:04:12.000-05:00"
                    ],
                    [
                        "2015-01-13T18:12:31.000-05:00",
                        "2015-01-13T18:27:03.000-05:00"
                    ],
                    [
                        "2015-01-13T19:01:46.000-05:00",
                        "2015-01-13T20:12:08.000-05:00"
                    ],
                    [
                        "2015-01-13T21:45:19.000-05:00",
                        "2015-01-13T22:09:32.000-05:00"
                    ],
                    [
                        "2015-01-13T22:24:04.000-05:00",
                        "2015-01-14T00:00:00.000-05:00"
                    ]
                ]
            },
            "geometry": {
                "type": "MultiLineString",
                "coordinates": [
                    [
                        [
                            -77.016245267,
                            38.9087781337
                        ],
                        [
                            -77.016245267,
                            38.9087781337
                        ]
                    ],
                    [
                        [
                            -77.06889867782593,
                            38.896978274248625
                        ],
                        [
                            -77.06889867782593,
                            38.896978274248625
                        ]
                    ],
                    [
                        [
                            -77.07069039344788,
                            38.89536670625987
                        ],
                        [
                            -77.07069039344788,
                            38.89536670625987
                        ]
                    ],
                    [
                        [
                            -77.08865697857264,
                            38.864741457304056
                        ],
                        [
                            -77.08865697857264,
                            38.864741457304056
                        ]
                    ],
                    [
                        [
                            -77.08865697857264,
                            38.864741457304056
                        ],
                        [
                            -77.08865697857264,
                            38.864741457304056
                        ]
                    ],
                    [
                        [
                            -77.016245267,
                            38.9087781337
                        ],
                        [
                            -77.016245267,
                            38.9087781337
                        ]
                    ]
                ]
            }
        },
        {
            "type": "Feature",
            "properties": {
                "name": "14/01/15",
                "time": "2015-01-14T00:00:00.000-05:00",
                "coordTimes": [
                    [
                        "2015-01-14T00:00:00.000-05:00",
                        "2015-01-14T09:42:56.000-05:00"
                    ],
                    [
                        "2015-01-14T10:17:46.000-05:00",
                        "2015-01-14T10:44:21.000-05:00"
                    ],
                    [
                        "2015-01-14T10:50:25.000-05:00",
                        "2015-01-14T10:51:47.000-05:00"
                    ],
                    [
                        "2015-01-14T10:54:26.000-05:00",
                        "2015-01-14T12:33:12.000-05:00"
                    ],
                    [
                        "2015-01-14T12:51:19.000-05:00",
                        "2015-01-14T13:38:14.000-05:00"
                    ],
                    [
                        "2015-01-14T13:43:28.000-05:00",
                        "2015-01-14T13:47:18.000-05:00"
                    ],
                    [
                        "2015-01-14T13:55:12.000-05:00",
                        "2015-01-14T14:08:47.000-05:00"
                    ],
                    [
                        "2015-01-14T14:20:32.000-05:00",
                        "2015-01-14T18:15:42.000-05:00"
                    ],
                    [
                        "2015-01-14T18:28:37.000-05:00",
                        "2015-01-14T20:12:46.000-05:00"
                    ],
                    [
                        "2015-01-14T20:26:45.000-05:00",
                        "2015-01-15T00:00:00.000-05:00"
                    ]
                ]
            },
            "geometry": {
                "type": "MultiLineString",
                "coordinates": [
                    [
                        [
                            -77.016245267,
                            38.9087781337
                        ],
                        [
                            -77.016245267,
                            38.9087781337
                        ]
                    ],
                    [
                        [
                            -77.03958864160882,
                            38.8983727030669
                        ],
                        [
                            -77.03958864160882,
                            38.8983727030669
                        ]
                    ],
                    [
                        [
                            -77.0395166731,
                            38.8966989506
                        ],
                        [
                            -77.0395166731,
                            38.8966989506
                        ]
                    ],
                    [
                        [
                            -77.03866481781006,
                            38.89757947159315
                        ],
                        [
                            -77.03866481781006,
                            38.89757947159315
                        ]
                    ],
                    [
                        [
                            -77.0467707978,
                            38.9026309391
                        ],
                        [
                            -77.0467707978,
                            38.9026309391
                        ]
                    ],
                    [
                        [
                            -77.0446510434,
                            38.9015651123
                        ],
                        [
                            -77.0446510434,
                            38.9015651123
                        ]
                    ],
                    [
                        [
                            -77.04185446557315,
                            38.903571647867814
                        ],
                        [
                            -77.04185446557315,
                            38.903571647867814
                        ]
                    ],
                    [
                        [
                            -77.0341572380347,
                            38.904864216921446
                        ],
                        [
                            -77.0341572380347,
                            38.904864216921446
                        ]
                    ],
                    [
                        [
                            -77.0434568216359,
                            38.90484498497507
                        ],
                        [
                            -77.0434568216359,
                            38.90484498497507
                        ]
                    ],
                    [
                        [
                            -77.02705889940262,
                            38.91677544772698
                        ],
                        [
                            -77.02705889940262,
                            38.91677544772698
                        ]
                    ]
                ]
            }
        },
        {
            "type": "Feature",
            "properties": {
                "name": "15/01/15",
                "time": "2015-01-15T00:00:00.000-05:00",
                "coordTimes": [
                    [
                        "2015-01-15T00:00:00.000-05:00",
                        "2015-01-15T00:45:18.000-05:00"
                    ],
                    [
                        "2015-01-15T00:52:27.000-05:00",
                        "2015-01-15T01:01:39.000-05:00"
                    ],
                    [
                        "2015-01-15T01:09:14.000-05:00",
                        "2015-01-15T08:54:43.000-05:00"
                    ],
                    [
                        "2015-01-15T09:34:18.000-05:00",
                        "2015-01-15T12:16:15.000-05:00"
                    ],
                    [
                        "2015-01-15T12:25:06.000-05:00",
                        "2015-01-15T12:34:51.000-05:00"
                    ],
                    [
                        "2015-01-15T12:38:08.000-05:00",
                        "2015-01-15T17:12:35.000-05:00"
                    ],
                    [
                        "2015-01-15T17:45:17.000-05:00",
                        "2015-01-16T00:00:00.000-05:00"
                    ]
                ]
            },
            "geometry": {
                "type": "MultiLineString",
                "coordinates": [
                    [
                        [
                            -77.02705889940262,
                            38.91677544772698
                        ],
                        [
                            -77.02705889940262,
                            38.91677544772698
                        ]
                    ],
                    [
                        [
                            -77.02170232261857,
                            38.915529044065465
                        ],
                        [
                            -77.02170232261857,
                            38.915529044065465
                        ]
                    ],
                    [
                        [
                            -77.016245267,
                            38.9087781337
                        ],
                        [
                            -77.016245267,
                            38.9087781337
                        ]
                    ],
                    [
                        [
                            -77.06889867782593,
                            38.896978274248625
                        ],
                        [
                            -77.06889867782593,
                            38.896978274248625
                        ]
                    ],
                    [
                        [
                            -77.0710398336,
                            38.8968859308
                        ],
                        [
                            -77.0710398336,
                            38.8968859308
                        ]
                    ],
                    [
                        [
                            -77.06889867782593,
                            38.896978274248625
                        ],
                        [
                            -77.06889867782593,
                            38.896978274248625
                        ]
                    ],
                    [
                        [
                            -77.016245267,
                            38.9087781337
                        ],
                        [
                            -77.016245267,
                            38.9087781337
                        ]
                    ]
                ]
            }
        },
        {
            "type": "Feature",
            "properties": {
                "name": "16/01/15",
                "time": "2015-01-16T00:00:00.000-05:00",
                "coordTimes": [
                    [
                        "2015-01-16T00:00:00.000-05:00",
                        "2015-01-16T08:11:11.000-05:00"
                    ],
                    [
                        "2015-01-16T08:56:39.000-05:00",
                        "2015-01-16T17:00:19.000-05:00"
                    ],
                    [
                        "2015-01-16T17:26:33.000-05:00",
                        "2015-01-16T19:38:13.000-05:00"
                    ],
                    [
                        "2015-01-16T19:58:46.000-05:00",
                        "2015-01-16T21:46:04.000-05:00"
                    ],
                    [
                        "2015-01-16T21:52:03.000-05:00",
                        "2015-01-16T21:56:25.000-05:00"
                    ],
                    [
                        "2015-01-16T23:48:30.000-05:00",
                        "2015-01-17T00:00:00.000-05:00"
                    ]
                ]
            },
            "geometry": {
                "type": "MultiLineString",
                "coordinates": [
                    [
                        [
                            -77.016245267,
                            38.9087781337
                        ],
                        [
                            -77.016245267,
                            38.9087781337
                        ]
                    ],
                    [
                        [
                            -77.06889867782593,
                            38.896978274248625
                        ],
                        [
                            -77.06889867782593,
                            38.896978274248625
                        ]
                    ],
                    [
                        [
                            -77.032358,
                            38.91164839267731
                        ],
                        [
                            -77.032358,
                            38.91164839267731
                        ]
                    ],
                    [
                        [
                            -76.99128783352278,
                            38.900283615320866
                        ],
                        [
                            -76.99128783352278,
                            38.900283615320866
                        ]
                    ],
                    [
                        [
                            -76.98712348937988,
                            38.89985061562848
                        ],
                        [
                            -76.98712348937988,
                            38.89985061562848
                        ]
                    ],
                    [
                        [
                            -77.016245267,
                            38.9087781337
                        ],
                        [
                            -77.016245267,
                            38.9087781337
                        ]
                    ]
                ]
            }
        },
        {
            "type": "Feature",
            "properties": {
                "name": "17/01/15",
                "time": "2015-01-17T00:00:00.000-05:00",
                "coordTimes": [
                    [
                        "2015-01-17T00:00:00.000-05:00",
                        "2015-01-17T10:23:12.000-05:00"
                    ],
                    [
                        "2015-01-17T13:31:54.000-05:00",
                        "2015-01-17T13:40:05.000-05:00"
                    ],
                    [
                        "2015-01-17T13:40:06.000-05:00",
                        "2015-01-17T14:00:14.000-05:00"
                    ],
                    [
                        "2015-01-17T14:05:41.000-05:00",
                        "2015-01-17T14:12:16.000-05:00"
                    ],
                    [
                        "2015-01-17T14:14:33.000-05:00",
                        "2015-01-17T14:26:39.000-05:00"
                    ],
                    [
                        "2015-01-17T17:49:48.000-05:00",
                        "2015-01-17T23:17:56.000-05:00"
                    ],
                    [
                        "2015-01-17T23:30:44.000-05:00",
                        "2015-01-18T00:00:00.000-05:00"
                    ]
                ]
            },
            "geometry": {
                "type": "MultiLineString",
                "coordinates": [
                    [
                        [
                            -77.016245267,
                            38.9087781337
                        ],
                        [
                            -77.016245267,
                            38.9087781337
                        ]
                    ],
                    [
                        [
                            -78.3526626456,
                            38.5560350557
                        ],
                        [
                            -78.3526626456,
                            38.5560350557
                        ]
                    ],
                    [
                        [
                            -78.3534026766,
                            38.5572227924
                        ],
                        [
                            -78.3534026766,
                            38.5572227924
                        ]
                    ],
                    [
                        [
                            -78.3576156775,
                            38.5598652776
                        ],
                        [
                            -78.3576156775,
                            38.5598652776
                        ]
                    ],
                    [
                        [
                            -78.3585370435,
                            38.560801513
                        ],
                        [
                            -78.3585370435,
                            38.560801513
                        ]
                    ],
                    [
                        [
                            -77.016245267,
                            38.9087781337
                        ],
                        [
                            -77.016245267,
                            38.9087781337
                        ]
                    ],
                    [
                        [
                            -77.016245267,
                            38.9087781337
                        ],
                        [
                            -77.016245267,
                            38.9087781337
                        ]
                    ]
                ]
            }
        },
        {
            "type": "Feature",
            "properties": {
                "name": "18/01/15",
                "time": "2015-01-18T00:00:00.000-05:00",
                "coordTimes": [
                    [
                        "2015-01-18T00:00:00.000-05:00",
                        "2015-01-18T14:56:02.000-05:00"
                    ],
                    [
                        "2015-01-18T15:11:47.000-05:00",
                        "2015-01-18T17:02:35.000-05:00"
                    ],
                    [
                        "2015-01-18T17:07:01.000-05:00",
                        "2015-01-18T18:38:53.000-05:00"
                    ],
                    [
                        "2015-01-18T18:52:23.000-05:00",
                        "2015-01-18T21:26:58.000-05:00"
                    ],
                    [
                        "2015-01-18T21:33:07.000-05:00",
                        "2015-01-19T00:00:00.000-05:00"
                    ]
                ]
            },
            "geometry": {
                "type": "MultiLineString",
                "coordinates": [
                    [
                        [
                            -77.016245267,
                            38.9087781337
                        ],
                        [
                            -77.016245267,
                            38.9087781337
                        ]
                    ],
                    [
                        [
                            -77.0209825411668,
                            38.898754083782165
                        ],
                        [
                            -77.0209825411668,
                            38.898754083782165
                        ]
                    ],
                    [
                        [
                            -77.022102,
                            38.900098
                        ],
                        [
                            -77.022102,
                            38.900098
                        ]
                    ],
                    [
                        [
                            -77.0333057641983,
                            38.90979019093789
                        ],
                        [
                            -77.0333057641983,
                            38.90979019093789
                        ]
                    ],
                    [
                        [
                            -77.016245267,
                            38.9087781337
                        ],
                        [
                            -77.016245267,
                            38.9087781337
                        ]
                    ]
                ]
            }
        },
        {
            "type": "Feature",
            "properties": {
                "name": "19/01/15",
                "time": "2015-01-19T00:00:00.000-05:00",
                "coordTimes": [
                    [
                        "2015-01-19T00:00:00.000-05:00",
                        "2015-01-19T00:44:42.000-05:00"
                    ],
                    [
                        "2015-01-19T00:55:07.000-05:00",
                        "2015-01-19T16:03:00.000-05:00"
                    ],
                    [
                        "2015-01-19T16:20:03.000-05:00",
                        "2015-01-19T18:48:58.000-05:00"
                    ],
                    [
                        "2015-01-19T19:20:24.000-05:00",
                        "2015-01-20T00:00:00.000-05:00"
                    ]
                ]
            },
            "geometry": {
                "type": "MultiLineString",
                "coordinates": [
                    [
                        [
                            -77.016245267,
                            38.9087781337
                        ],
                        [
                            -77.016245267,
                            38.9087781337
                        ]
                    ],
                    [
                        [
                            -77.016245267,
                            38.9087781337
                        ],
                        [
                            -77.016245267,
                            38.9087781337
                        ]
                    ],
                    [
                        [
                            -76.99651305384873,
                            38.884913240033505
                        ],
                        [
                            -76.99651305384873,
                            38.884913240033505
                        ]
                    ],
                    [
                        [
                            -77.016245267,
                            38.9087781337
                        ],
                        [
                            -77.016245267,
                            38.9087781337
                        ]
                    ]
                ]
            }
        },
        {
            "type": "Feature",
            "properties": {
                "name": "20/01/15",
                "time": "2015-01-20T00:00:00.000-05:00",
                "coordTimes": [
                    [
                        "2015-01-20T00:00:00.000-05:00",
                        "2015-01-20T07:53:14.000-05:00"
                    ],
                    [
                        "2015-01-20T08:10:22.000-05:00",
                        "2015-01-20T08:22:33.000-05:00"
                    ],
                    [
                        "2015-01-20T08:30:27.000-05:00",
                        "2015-01-20T12:31:27.000-05:00"
                    ],
                    [
                        "2015-01-20T12:36:31.000-05:00",
                        "2015-01-20T12:46:28.000-05:00"
                    ],
                    [
                        "2015-01-20T12:50:05.000-05:00",
                        "2015-01-20T18:15:15.000-05:00"
                    ],
                    [
                        "2015-01-20T18:52:56.000-05:00",
                        "2015-01-20T21:56:26.000-05:00"
                    ],
                    [
                        "2015-01-20T22:26:22.000-05:00",
                        "2015-01-21T00:00:00.000-05:00"
                    ]
                ]
            },
            "geometry": {
                "type": "MultiLineString",
                "coordinates": [
                    [
                        [
                            -77.016245267,
                            38.9087781337
                        ],
                        [
                            -77.016245267,
                            38.9087781337
                        ]
                    ],
                    [
                        [
                            -77.0186292437,
                            38.9025542393
                        ],
                        [
                            -77.0186292437,
                            38.9025542393
                        ]
                    ],
                    [
                        [
                            -77.06889867782593,
                            38.896978274248625
                        ],
                        [
                            -77.06889867782593,
                            38.896978274248625
                        ]
                    ],
                    [
                        [
                            -77.0709130521,
                            38.8982314933
                        ],
                        [
                            -77.0709130521,
                            38.8982314933
                        ]
                    ],
                    [
                        [
                            -77.06889867782593,
                            38.896978274248625
                        ],
                        [
                            -77.06889867782593,
                            38.896978274248625
                        ]
                    ],
                    [
                        [
                            -77.08865697857264,
                            38.864741457304056
                        ],
                        [
                            -77.08865697857264,
                            38.864741457304056
                        ]
                    ],
                    [
                        [
                            -77.016245267,
                            38.9087781337
                        ],
                        [
                            -77.016245267,
                            38.9087781337
                        ]
                    ]
                ]
            }
        },
        {
            "type": "Feature",
            "properties": {
                "name": "21/01/15",
                "time": "2015-01-21T00:00:00.000-05:00",
                "coordTimes": [
                    [
                        "2015-01-21T00:00:00.000-05:00",
                        "2015-01-21T08:11:12.000-05:00"
                    ],
                    [
                        "2015-01-21T08:53:39.000-05:00",
                        "2015-01-21T16:29:36.000-05:00"
                    ],
                    [
                        "2015-01-21T16:54:50.000-05:00",
                        "2015-01-21T18:14:08.000-05:00"
                    ],
                    [
                        "2015-01-21T18:20:46.000-05:00",
                        "2015-01-21T19:25:35.000-05:00"
                    ],
                    [
                        "2015-01-21T19:31:29.000-05:00",
                        "2015-01-21T19:37:16.000-05:00"
                    ],
                    [
                        "2015-01-21T19:43:51.000-05:00",
                        "2015-01-21T23:19:02.000-05:00"
                    ],
                    [
                        "2015-01-21T23:36:20.000-05:00",
                        "2015-01-22T00:00:00.000-05:00"
                    ]
                ]
            },
            "geometry": {
                "type": "MultiLineString",
                "coordinates": [
                    [
                        [
                            -77.016245267,
                            38.9087781337
                        ],
                        [
                            -77.016245267,
                            38.9087781337
                        ]
                    ],
                    [
                        [
                            -77.06889867782593,
                            38.896978274248625
                        ],
                        [
                            -77.06889867782593,
                            38.896978274248625
                        ]
                    ],
                    [
                        [
                            -77.0289808275,
                            38.9055668658
                        ],
                        [
                            -77.0289808275,
                            38.9055668658
                        ]
                    ],
                    [
                        [
                            -77.016245267,
                            38.9087781337
                        ],
                        [
                            -77.016245267,
                            38.9087781337
                        ]
                    ],
                    [
                        [
                            -77.02191038364764,
                            38.91582809562651
                        ],
                        [
                            -77.02191038364764,
                            38.91582809562651
                        ]
                    ],
                    [
                        [
                            -77.02705889940262,
                            38.91677544772698
                        ],
                        [
                            -77.02705889940262,
                            38.91677544772698
                        ]
                    ],
                    [
                        [
                            -77.016245267,
                            38.9087781337
                        ],
                        [
                            -77.016245267,
                            38.9087781337
                        ]
                    ]
                ]
            }
        },
        {
            "type": "Feature",
            "properties": {
                "name": "22/01/15",
                "time": "2015-01-22T00:00:00.000-05:00",
                "coordTimes": [
                    [
                        "2015-01-22T00:00:00.000-05:00",
                        "2015-01-22T08:27:18.000-05:00"
                    ],
                    [
                        "2015-01-22T09:09:58.000-05:00",
                        "2015-01-22T11:35:13.000-05:00"
                    ],
                    [
                        "2015-01-22T11:48:03.000-05:00",
                        "2015-01-22T12:07:38.000-05:00"
                    ],
                    [
                        "2015-01-22T12:13:23.000-05:00",
                        "2015-01-22T12:18:38.000-05:00"
                    ],
                    [
                        "2015-01-22T12:23:43.000-05:00",
                        "2015-01-22T18:16:46.000-05:00"
                    ],
                    [
                        "2015-01-22T18:42:11.000-05:00",
                        "2015-01-22T22:20:15.000-05:00"
                    ],
                    [
                        "2015-01-22T22:27:47.000-05:00",
                        "2015-01-23T00:00:00.000-05:00"
                    ]
                ]
            },
            "geometry": {
                "type": "MultiLineString",
                "coordinates": [
                    [
                        [
                            -77.016245267,
                            38.9087781337
                        ],
                        [
                            -77.016245267,
                            38.9087781337
                        ]
                    ],
                    [
                        [
                            -77.06889867782593,
                            38.896978274248625
                        ],
                        [
                            -77.06889867782593,
                            38.896978274248625
                        ]
                    ],
                    [
                        [
                            -77.06889867782593,
                            38.896978274248625
                        ],
                        [
                            -77.06889867782593,
                            38.896978274248625
                        ]
                    ],
                    [
                        [
                            -77.07078355566608,
                            38.895051124541055
                        ],
                        [
                            -77.07078355566608,
                            38.895051124541055
                        ]
                    ],
                    [
                        [
                            -77.06889867782593,
                            38.896978274248625
                        ],
                        [
                            -77.06889867782593,
                            38.896978274248625
                        ]
                    ],
                    [
                        [
                            -77.032358,
                            38.91164839267731
                        ],
                        [
                            -77.032358,
                            38.91164839267731
                        ]
                    ],
                    [
                        [
                            -77.016245267,
                            38.9087781337
                        ],
                        [
                            -77.016245267,
                            38.9087781337
                        ]
                    ]
                ]
            }
        },
        {
            "type": "Feature",
            "properties": {
                "name": "23/01/15",
                "time": "2015-01-23T00:00:00.000-05:00",
                "coordTimes": [
                    [
                        "2015-01-23T00:00:00.000-05:00",
                        "2015-01-23T08:29:06.000-05:00"
                    ],
                    [
                        "2015-01-23T09:13:56.000-05:00",
                        "2015-01-23T17:28:06.000-05:00"
                    ],
                    [
                        "2015-01-23T18:10:45.000-05:00",
                        "2015-01-23T18:55:40.000-05:00"
                    ],
                    [
                        "2015-01-23T19:08:33.000-05:00",
                        "2015-01-24T00:00:00.000-05:00"
                    ]
                ]
            },
            "geometry": {
                "type": "MultiLineString",
                "coordinates": [
                    [
                        [
                            -77.016245267,
                            38.9087781337
                        ],
                        [
                            -77.016245267,
                            38.9087781337
                        ]
                    ],
                    [
                        [
                            -77.06889867782593,
                            38.896978274248625
                        ],
                        [
                            -77.06889867782593,
                            38.896978274248625
                        ]
                    ],
                    [
                        [
                            -77.016245267,
                            38.9087781337
                        ],
                        [
                            -77.016245267,
                            38.9087781337
                        ]
                    ],
                    [
                        [
                            -77.02380540954114,
                            38.91779684642323
                        ],
                        [
                            -77.02380540954114,
                            38.91779684642323
                        ]
                    ]
                ]
            }
        },
        {
            "type": "Feature",
            "properties": {
                "name": "24/01/15",
                "time": "2015-01-24T00:00:00.000-05:00",
                "coordTimes": [
                    [
                        "2015-01-24T00:00:00.000-05:00",
                        "2015-01-24T00:06:51.000-05:00"
                    ],
                    [
                        "2015-01-24T00:17:53.000-05:00",
                        "2015-01-24T01:28:49.000-05:00"
                    ],
                    [
                        "2015-01-24T12:18:17.000-05:00",
                        "2015-01-24T12:36:30.000-05:00"
                    ],
                    [
                        "2015-01-24T12:41:51.000-05:00",
                        "2015-01-24T17:04:48.000-05:00"
                    ],
                    [
                        "2015-01-24T17:14:53.000-05:00",
                        "2015-01-24T17:36:49.000-05:00"
                    ],
                    [
                        "2015-01-24T17:45:55.000-05:00",
                        "2015-01-25T00:00:00.000-05:00"
                    ]
                ]
            },
            "geometry": {
                "type": "MultiLineString",
                "coordinates": [
                    [
                        [
                            -77.02380540954114,
                            38.91779684642323
                        ],
                        [
                            -77.02380540954114,
                            38.91779684642323
                        ]
                    ],
                    [
                        [
                            -77.03106471500291,
                            38.91696324943379
                        ],
                        [
                            -77.03106471500291,
                            38.91696324943379
                        ]
                    ],
                    [
                        [
                            -77.0021317164,
                            38.9194274207
                        ],
                        [
                            -77.0021317164,
                            38.9194274207
                        ]
                    ],
                    [
                        [
                            -77.016245267,
                            38.9087781337
                        ],
                        [
                            -77.016245267,
                            38.9087781337
                        ]
                    ],
                    [
                        [
                            -77.02268076867074,
                            38.90897736048679
                        ],
                        [
                            -77.02268076867074,
                            38.90897736048679
                        ]
                    ],
                    [
                        [
                            -77.016245267,
                            38.9087781337
                        ],
                        [
                            -77.016245267,
                            38.9087781337
                        ]
                    ]
                ]
            }
        },
        {
            "type": "Feature",
            "properties": {
                "name": "25/01/15",
                "time": "2015-01-25T00:00:00.000-05:00",
                "coordTimes": [
                    [
                        "2015-01-25T00:00:00.000-05:00",
                        "2015-01-25T11:41:28.000-05:00"
                    ],
                    [
                        "2015-01-25T11:55:02.000-05:00",
                        "2015-01-25T13:05:28.000-05:00"
                    ],
                    [
                        "2015-01-25T13:45:51.000-05:00",
                        "2015-01-25T15:35:40.000-05:00"
                    ],
                    [
                        "2015-01-25T15:38:14.000-05:00",
                        "2015-01-25T17:25:07.000-05:00"
                    ],
                    [
                        "2015-01-25T17:42:27.000-05:00",
                        "2015-01-26T00:00:00.000-05:00"
                    ]
                ]
            },
            "geometry": {
                "type": "MultiLineString",
                "coordinates": [
                    [
                        [
                            -77.016245267,
                            38.9087781337
                        ],
                        [
                            -77.016245267,
                            38.9087781337
                        ]
                    ],
                    [
                        [
                            -77.01626449281058,
                            38.89953249346599
                        ],
                        [
                            -77.01626449281058,
                            38.89953249346599
                        ]
                    ],
                    [
                        [
                            -77.0209825411668,
                            38.898754083782165
                        ],
                        [
                            -77.0209825411668,
                            38.898754083782165
                        ]
                    ],
                    [
                        [
                            -77.022102,
                            38.900098
                        ],
                        [
                            -77.022102,
                            38.900098
                        ]
                    ],
                    [
                        [
                            -77.016245267,
                            38.9087781337
                        ],
                        [
                            -77.016245267,
                            38.9087781337
                        ]
                    ]
                ]
            }
        },
        {
            "type": "Feature",
            "properties": {
                "name": "26/01/15",
                "time": "2015-01-26T00:00:00.000-05:00",
                "coordTimes": [
                    [
                        "2015-01-26T00:00:00.000-05:00",
                        "2015-01-26T08:12:59.000-05:00"
                    ],
                    [
                        "2015-01-26T08:50:20.000-05:00",
                        "2015-01-26T13:26:55.000-05:00"
                    ],
                    [
                        "2015-01-26T13:46:56.000-05:00",
                        "2015-01-26T15:03:57.000-05:00"
                    ],
                    [
                        "2015-01-26T15:38:52.000-05:00",
                        "2015-01-26T15:49:57.000-05:00"
                    ],
                    [
                        "2015-01-26T16:02:17.000-05:00",
                        "2015-01-27T00:00:00.000-05:00"
                    ]
                ]
            },
            "geometry": {
                "type": "MultiLineString",
                "coordinates": [
                    [
                        [
                            -77.016245267,
                            38.9087781337
                        ],
                        [
                            -77.016245267,
                            38.9087781337
                        ]
                    ],
                    [
                        [
                            -77.06889867782593,
                            38.896978274248625
                        ],
                        [
                            -77.06889867782593,
                            38.896978274248625
                        ]
                    ],
                    [
                        [
                            -77.040593554,
                            38.8993759695
                        ],
                        [
                            -77.040593554,
                            38.8993759695
                        ]
                    ],
                    [
                        [
                            -77.016245267,
                            38.9087781337
                        ],
                        [
                            -77.016245267,
                            38.9087781337
                        ]
                    ],
                    [
                        [
                            -77.016245267,
                            38.9087781337
                        ],
                        [
                            -77.016245267,
                            38.9087781337
                        ]
                    ]
                ]
            }
        },
        {
            "type": "Feature",
            "properties": {
                "name": "27/01/15",
                "time": "2015-01-27T00:00:00.000-05:00",
                "coordTimes": [
                    [
                        "2015-01-27T00:00:00.000-05:00",
                        "2015-01-27T08:30:58.000-05:00"
                    ],
                    [
                        "2015-01-27T09:21:22.000-05:00",
                        "2015-01-27T18:11:05.000-05:00"
                    ],
                    [
                        "2015-01-27T18:54:10.000-05:00",
                        "2015-01-27T20:00:00.000-05:00"
                    ],
                    [
                        "2015-01-27T20:14:34.000-05:00",
                        "2015-01-28T00:00:00.000-05:00"
                    ]
                ]
            },
            "geometry": {
                "type": "MultiLineString",
                "coordinates": [
                    [
                        [
                            -77.016245267,
                            38.9087781337
                        ],
                        [
                            -77.016245267,
                            38.9087781337
                        ]
                    ],
                    [
                        [
                            -77.06889867782593,
                            38.896978274248625
                        ],
                        [
                            -77.06889867782593,
                            38.896978274248625
                        ]
                    ],
                    [
                        [
                            -77.0886162828,
                            38.8641863031
                        ],
                        [
                            -77.0886162828,
                            38.8641863031
                        ]
                    ],
                    [
                        [
                            -77.016245267,
                            38.9087781337
                        ],
                        [
                            -77.016245267,
                            38.9087781337
                        ]
                    ]
                ]
            }
        },
        {
            "type": "Feature",
            "properties": {
                "name": "28/01/15",
                "time": "2015-01-28T00:00:00.000-05:00",
                "coordTimes": [
                    [
                        "2015-01-28T00:00:00.000-05:00",
                        "2015-01-28T07:44:36.000-05:00"
                    ],
                    [
                        "2015-01-28T08:24:22.000-05:00",
                        "2015-01-28T12:13:10.000-05:00"
                    ],
                    [
                        "2015-01-28T12:18:10.000-05:00",
                        "2015-01-28T12:21:08.000-05:00"
                    ],
                    [
                        "2015-01-28T12:25:48.000-05:00",
                        "2015-01-28T18:44:49.000-05:00"
                    ],
                    [
                        "2015-01-28T19:16:50.000-05:00",
                        "2015-01-28T19:23:22.000-05:00"
                    ],
                    [
                        "2015-01-28T19:29:50.000-05:00",
                        "2015-01-28T23:14:53.000-05:00"
                    ],
                    [
                        "2015-01-28T23:23:18.000-05:00",
                        "2015-01-28T23:25:43.000-05:00"
                    ],
                    [
                        "2015-01-28T23:31:19.000-05:00",
                        "2015-01-29T00:00:00.000-05:00"
                    ]
                ]
            },
            "geometry": {
                "type": "MultiLineString",
                "coordinates": [
                    [
                        [
                            -77.016245267,
                            38.9087781337
                        ],
                        [
                            -77.016245267,
                            38.9087781337
                        ]
                    ],
                    [
                        [
                            -77.06889867782593,
                            38.896978274248625
                        ],
                        [
                            -77.06889867782593,
                            38.896978274248625
                        ]
                    ],
                    [
                        [
                            -77.07078355566608,
                            38.895051124541055
                        ],
                        [
                            -77.07078355566608,
                            38.895051124541055
                        ]
                    ],
                    [
                        [
                            -77.06889867782593,
                            38.896978274248625
                        ],
                        [
                            -77.06889867782593,
                            38.896978274248625
                        ]
                    ],
                    [
                        [
                            -77.02191038364764,
                            38.91582809562651
                        ],
                        [
                            -77.02191038364764,
                            38.91582809562651
                        ]
                    ],
                    [
                        [
                            -77.02705889940262,
                            38.91677544772698
                        ],
                        [
                            -77.02705889940262,
                            38.91677544772698
                        ]
                    ],
                    [
                        [
                            -77.02170232261857,
                            38.915529044065465
                        ],
                        [
                            -77.02170232261857,
                            38.915529044065465
                        ]
                    ],
                    [
                        [
                            -77.016245267,
                            38.9087781337
                        ],
                        [
                            -77.016245267,
                            38.9087781337
                        ]
                    ]
                ]
            }
        },
        {
            "type": "Feature",
            "properties": {
                "name": "29/01/15",
                "time": "2015-01-29T00:00:00.000-05:00",
                "coordTimes": [
                    [
                        "2015-01-29T00:00:00.000-05:00",
                        "2015-01-29T08:43:58.000-05:00"
                    ],
                    [
                        "2015-01-29T09:27:51.000-05:00",
                        "2015-01-29T11:57:25.000-05:00"
                    ],
                    [
                        "2015-01-29T12:02:12.000-05:00",
                        "2015-01-29T12:07:01.000-05:00"
                    ],
                    [
                        "2015-01-29T12:11:15.000-05:00",
                        "2015-01-29T14:10:38.000-05:00"
                    ],
                    [
                        "2015-01-29T14:22:21.000-05:00",
                        "2015-01-29T17:09:22.000-05:00"
                    ],
                    [
                        "2015-01-29T17:55:41.000-05:00",
                        "2015-01-29T23:47:06.000-05:00"
                    ]
                ]
            },
            "geometry": {
                "type": "MultiLineString",
                "coordinates": [
                    [
                        [
                            -77.016245267,
                            38.9087781337
                        ],
                        [
                            -77.016245267,
                            38.9087781337
                        ]
                    ],
                    [
                        [
                            -77.06889867782593,
                            38.896978274248625
                        ],
                        [
                            -77.06889867782593,
                            38.896978274248625
                        ]
                    ],
                    [
                        [
                            -77.07069039344788,
                            38.89536670625987
                        ],
                        [
                            -77.07069039344788,
                            38.89536670625987
                        ]
                    ],
                    [
                        [
                            -77.06889867782593,
                            38.896978274248625
                        ],
                        [
                            -77.06889867782593,
                            38.896978274248625
                        ]
                    ],
                    [
                        [
                            -77.06889867782593,
                            38.896978274248625
                        ],
                        [
                            -77.06889867782593,
                            38.896978274248625
                        ]
                    ],
                    [
                        [
                            -77.016245267,
                            38.9087781337
                        ],
                        [
                            -77.016245267,
                            38.9087781337
                        ]
                    ]
                ]
            }
        },
        {
            "type": "Feature",
            "properties": {
                "name": "30/01/15",
                "time": "2015-01-30T00:48:20.000-05:00",
                "coordTimes": [
                    [
                        "2015-01-30T00:48:20.000-05:00",
                        "2015-01-30T00:53:08.000-05:00"
                    ],
                    [
                        "2015-01-30T01:51:39.000-05:00",
                        "2015-01-30T01:54:15.000-05:00"
                    ],
                    [
                        "2015-01-30T02:08:03.000-05:00",
                        "2015-01-30T02:16:41.000-05:00"
                    ],
                    [
                        "2015-01-30T02:42:52.000-05:00",
                        "2015-01-30T02:50:11.000-05:00"
                    ],
                    [
                        "2015-01-30T03:32:40.000-05:00",
                        "2015-01-30T03:40:38.000-05:00"
                    ],
                    [
                        "2015-01-30T04:02:16.000-05:00",
                        "2015-01-30T04:04:16.000-05:00"
                    ],
                    [
                        "2015-01-30T04:17:15.000-05:00",
                        "2015-01-30T05:22:06.000-05:00"
                    ],
                    [
                        "2015-01-30T05:38:45.000-05:00",
                        "2015-01-30T05:40:45.000-05:00"
                    ],
                    [
                        "2015-01-30T06:21:59.000-05:00",
                        "2015-01-30T07:09:16.000-05:00"
                    ],
                    [
                        "2015-01-30T07:23:17.000-05:00",
                        "2015-01-30T18:45:47.000-05:00"
                    ],
                    [
                        "2015-01-30T18:55:36.000-05:00",
                        "2015-01-30T19:09:11.000-05:00"
                    ],
                    [
                        "2015-01-30T19:21:33.000-05:00",
                        "2015-01-31T00:00:00.000-05:00"
                    ]
                ]
            },
            "geometry": {
                "type": "MultiLineString",
                "coordinates": [
                    [
                        [
                            -77.016245267,
                            38.9087781337
                        ],
                        [
                            -77.016245267,
                            38.9087781337
                        ]
                    ],
                    [
                        [
                            -77.016245267,
                            38.9087781337
                        ],
                        [
                            -77.016245267,
                            38.9087781337
                        ]
                    ],
                    [
                        [
                            -77.016245267,
                            38.9087781337
                        ],
                        [
                            -77.016245267,
                            38.9087781337
                        ]
                    ],
                    [
                        [
                            -77.016245267,
                            38.9087781337
                        ],
                        [
                            -77.016245267,
                            38.9087781337
                        ]
                    ],
                    [
                        [
                            -77.016245267,
                            38.9087781337
                        ],
                        [
                            -77.016245267,
                            38.9087781337
                        ]
                    ],
                    [
                        [
                            -77.016245267,
                            38.9087781337
                        ],
                        [
                            -77.016245267,
                            38.9087781337
                        ]
                    ],
                    [
                        [
                            -77.016245267,
                            38.9087781337
                        ],
                        [
                            -77.016245267,
                            38.9087781337
                        ]
                    ],
                    [
                        [
                            -77.016245267,
                            38.9087781337
                        ],
                        [
                            -77.016245267,
                            38.9087781337
                        ]
                    ],
                    [
                        [
                            -77.016245267,
                            38.9087781337
                        ],
                        [
                            -77.016245267,
                            38.9087781337
                        ]
                    ],
                    [
                        [
                            -77.016245267,
                            38.9087781337
                        ],
                        [
                            -77.016245267,
                            38.9087781337
                        ]
                    ],
                    [
                        [
                            -77.02268076867074,
                            38.90897736048679
                        ],
                        [
                            -77.02268076867074,
                            38.90897736048679
                        ]
                    ],
                    [
                        [
                            -77.0021317164,
                            38.9194274207
                        ],
                        [
                            -77.0021317164,
                            38.9194274207
                        ]
                    ]
                ]
            }
        },
        {
            "type": "Feature",
            "properties": {
                "name": "31/01/15",
                "time": "2015-01-31T00:00:00.000-05:00",
                "coordTimes": [
                    [
                        "2015-01-31T00:00:00.000-05:00",
                        "2015-01-31T12:23:52.000-05:00"
                    ],
                    [
                        "2015-01-31T13:12:34.000-05:00",
                        "2015-01-31T13:33:03.000-05:00"
                    ],
                    [
                        "2015-01-31T13:56:20.000-05:00",
                        "2015-01-31T19:08:43.000-05:00"
                    ],
                    [
                        "2015-01-31T19:24:43.000-05:00",
                        "2015-01-31T20:42:46.000-05:00"
                    ],
                    [
                        "2015-01-31T20:48:16.000-05:00",
                        "2015-02-01T00:00:00.000-05:00"
                    ]
                ]
            },
            "geometry": {
                "type": "MultiLineString",
                "coordinates": [
                    [
                        [
                            -77.0021317164,
                            38.9194274207
                        ],
                        [
                            -77.0021317164,
                            38.9194274207
                        ]
                    ],
                    [
                        [
                            -77.04185446557315,
                            38.92060867197093
                        ],
                        [
                            -77.04185446557315,
                            38.92060867197093
                        ]
                    ],
                    [
                        [
                            -77.016245267,
                            38.9087781337
                        ],
                        [
                            -77.016245267,
                            38.9087781337
                        ]
                    ],
                    [
                        [
                            -77.02170232261857,
                            38.915529044065465
                        ],
                        [
                            -77.02170232261857,
                            38.915529044065465
                        ]
                    ],
                    [
                        [
                            -77.02415966925224,
                            38.916707159161525
                        ],
                        [
                            -77.02415966925224,
                            38.916707159161525
                        ]
                    ]
                ]
            }
        },
        {
            "type": "Feature",
            "properties": {
                "name": "01/02/15",
                "time": "2015-02-01T00:00:00.000-05:00",
                "coordTimes": [
                    [
                        "2015-02-01T00:00:00.000-05:00",
                        "2015-02-01T00:11:26.000-05:00"
                    ],
                    [
                        "2015-02-01T00:21:40.000-05:00",
                        "2015-02-01T12:10:12.000-05:00"
                    ],
                    [
                        "2015-02-01T12:18:15.000-05:00",
                        "2015-02-01T12:37:26.000-05:00"
                    ],
                    [
                        "2015-02-01T12:44:55.000-05:00",
                        "2015-02-01T17:21:25.000-05:00"
                    ],
                    [
                        "2015-02-01T17:42:39.000-05:00",
                        "2015-02-01T17:55:03.000-05:00"
                    ],
                    [
                        "2015-02-01T18:24:08.000-05:00",
                        "2015-02-01T22:24:03.000-05:00"
                    ],
                    [
                        "2015-02-01T22:28:46.000-05:00",
                        "2015-02-01T22:42:15.000-05:00"
                    ],
                    [
                        "2015-02-01T22:57:48.000-05:00",
                        "2015-02-02T00:00:00.000-05:00"
                    ]
                ]
            },
            "geometry": {
                "type": "MultiLineString",
                "coordinates": [
                    [
                        [
                            -77.02415966925224,
                            38.916707159161525
                        ],
                        [
                            -77.02415966925224,
                            38.916707159161525
                        ]
                    ],
                    [
                        [
                            -77.016245267,
                            38.9087781337
                        ],
                        [
                            -77.016245267,
                            38.9087781337
                        ]
                    ],
                    [
                        [
                            -77.02268076867074,
                            38.90897736048679
                        ],
                        [
                            -77.02268076867074,
                            38.90897736048679
                        ]
